{
  "schema_version": "sophia.execution.recipe.v1",
  "snapshot_id": "fixture-recipe-snapshot-1",
  "recipe_id": "sophia-lead-review-v1",
  "recipe_version": "fixture-v1",
  "runtime_unit": "fixture-runtime-not-live",
  "adapter_version": "fixture-adapter-1",
  "preset_id": "fixture-review-preset",
  "preset_definition_sha256": "bbbbbbbbbbbbbbbbbbbbbbbbbbbbbbbbbbbbbbbbbbbbbbbbbbbbbbbbbbbbbbbb",
  "model": {
    "provider": "synthetic_provider",
    "requested": "fixture-model",
    "resolved": "fixture-model",
    "observed": null,
    "reasoning_effort": "fixture-supported-level",
    "billing_route_ref": "fixture-existing-approved-route"
  },
  "capability_set_ref": "fixture-capabilities-1",
  "context_manifest_ref": "fixture-context-1",
  "eligibility_revision": 7,
  "grant_ref": "fixture-grant-4",
  "cumulative_allowance_ref": "fixture-work-allowance-1",
  "allowed_tools": [
    "work_read_context",
    "work_read_source",
    "submit_review"
  ],
  "skill_hashes": {
    "coordination": "cccccccccccccccccccccccccccccccccccccccccccccccccccccccccccccccc"
  },
  "child_policy": "disabled",
  "configuration_change_boundary": "new_episode",
  "qualification_ref": "fixture-not-real-qualification",
  "created_at": "2026-09-30T12:00:00Z"
}
